{
  "title": "为什么普通人需要关注AI公司？",
  "rawText": "这是一段公开示例母稿。它讨论普通人为什么不必像投资人一样研究公司，但需要通过公司和产品变化理解AI时代的工作方式变化。",
  "targetAudience": "ordinary readers",
  "targetPlatforms": ["article", "zhihu", "xiaohongshu", "community"],
  "sourceNotes": [
    "This is fictional public-safe example content.",
    "No private information is included."
  ]
}

